polymer_name,type,applications,density,glass_transition_temperature,melting_point,tensile_strength,elongation,pubchem_cid,wiki_link,formula,recyclability,fun_fact,youtube_link
Dicyclopentadiene Resin (pDCPD),Thermoset,"Tractor body panels; Chemical tanks",1.03,150,Amorphous,45 MPa,10%,111198,https://en.wikipedia.org/wiki/Polydicyclopentadiene,(C10H12)n,Not recyclable,"pDCPD is formed via Reaction Injection Molding (RIM), curing from a liquid to a solid in just seconds.",https://www.youtube.com/results?search_query=Polydicyclopentadiene
Butyl Rubber (IIR),Elastomer,"Tire inner tubes; Basketball bladders",0.92,-70,Amorphous,15 MPa,600%,111198,https://en.wikipedia.org/wiki/Butyl_rubber,(C4H8·C5H8)n,Downcycled,"Butyl rubber is exceptionally impermeable to gases, which is why it keeps your tires inflated.",https://www.youtube.com/results?search_query=Butyl+rubber
Chlorobutyl Rubber (CIIR),Elastomer,"Pharmaceutical stoppers; Chem-suits",0.93,-65,Amorphous,10 MPa,500%,111198,https://en.wikipedia.org/wiki/Butyl_rubber,Hydrocarbon,Downcycled,"Adding chlorine to butyl rubber makes it cure faster and heavily resist ozone degradation.",https://www.youtube.com/results?search_query=Chlorobutyl+rubber
Poly(ether ketone) (PEK),Thermoplastic,"High-stress aerospace parts",1.30,152,373,110 MPa,15%,111198,https://en.wikipedia.org/wiki/Polyaryletherketone,(C19H12O2)n,Can be recycled,"PEK has an incredibly high continuous use temperature, surviving environments up to 250°C.",https://www.youtube.com/results?search_query=Polyether+ketone+PEK
Eudragit (Methacrylic Copolymer),Smart Polymer,"Enteric pill coatings",1.20,130,Amorphous,N/A,N/A,111198,https://en.wikipedia.org/wiki/Eudragit,Complex,Dissolves in body,"It protects medicine from stomach acid but dissolves perfectly once it reaches the intestines.",https://www.youtube.com/results?search_query=Eudragit+polymer
Poly(vinylidene fluoride-co-trifluoroethylene) (PVDF-TrFE),Smart Polymer,"Flexible touch sensors; Memory devices",1.80,-30,150,40 MPa,200%,111198,https://en.wikipedia.org/wiki/Polyvinylidene_fluoride,(C2H2F2·C2HF3)n,Hard to recycle,"This polymer has natural ferroelectric properties, meaning it has a switchable electrical polarization.",https://www.youtube.com/results?search_query=PVDF-TrFE
Poly(diallyldimethylammonium chloride) (pDADMAC),Smart Polymer,"Water purification; Pulp making",1.05,Amorphous,Amorphous,N/A,N/A,111198,https://en.wikipedia.org/wiki/PolyDADMAC,(C8H16ClN)n,Water Soluble,"A highly charged cationic polymer used to clump floating dirt particles in drinking water.",https://www.youtube.com/results?search_query=PolyDADMAC
Poly(lactic acid-co-caprolactone) (PLCL),Biopolymer,"Elastic tissue engineering scaffolds",1.15,20,Amorphous,15 MPa,400%,111198,https://en.wikipedia.org/wiki/Polylactic_acid,(C3H4O2·C6H10O2)n,Degrades in body,"It combines the strength of PLA with the rubbery elasticity of PCL for growing new heart valves.",https://www.youtube.com/results?search_query=PLCL+tissue+engineering
Poly(4-vinylphenol) (PVPh),Thermoplastic,"Organic thin-film transistors",1.16,150,Amorphous,N/A,N/A,111198,https://en.wikipedia.org/wiki/Poly(4-vinylphenol),(C8H8O)n,Hard to recycle,"It acts as an excellent dielectric (insulating) layer in printed, flexible electronics.",https://www.youtube.com/results?search_query=Polyvinylphenol
Linear Poly(ethylene imine) (L-PEI),Smart Polymer,"Non-viral gene therapy",1.05,-50,73,N/A,N/A,111198,https://en.wikipedia.org/wiki/Polyethylenimine,(C2H5N)n,Water Soluble,"Unlike branched PEI, linear PEI is solid at room temperature and is a gold standard for cell transfection.",https://www.youtube.com/results?search_query=Linear+Polyethylenimine
Polymethacrylimide (PMI) Foam,Thermoset,"Helicopter rotor blades; Radar domes",0.05,200,Amorphous,2 MPa,3%,111198,https://en.wikipedia.org/wiki/Polymethacrylimide,Complex,Not recyclable,"PMI foam (Rohacell) is one of the lightest, stiffest structural core materials in aerospace.",https://www.youtube.com/results?search_query=Rohacell+PMI+foam
Poly(vinyl butyrate),Thermoplastic,"Inks; Specialty Coatings",1.05,10,Amorphous,10 MPa,100%,111198,https://en.wikipedia.org/wiki/Polyvinyl_butyral,(C6H10O2)n,Hard to recycle,"Used as a low-toxicity binder in specialty printing inks.",https://www.youtube.com/results?search_query=Polyvinyl+butyrate
Poly(hexafluoropropylene oxide) (PFPE),Liquid Polymer,"Vacuum pump oils; Space lubricants",1.90,-90,Amorphous,N/A,N/A,111198,https://en.wikipedia.org/wiki/Krytox,(C3F6O)n,Hard to recycle,"PFPE (Krytox) is a liquid polymer that will not burn, even in 100% liquid oxygen environments!",https://www.youtube.com/results?search_query=PFPE+Krytox
Poly(cyclohexyl methacrylate) (PCHMA),Thermoplastic,"Optical discs; Lenses",1.10,104,Amorphous,45 MPa,5%,111198,https://en.wikipedia.org/wiki/Poly(methyl_methacrylate),(C10H16O2)n,Can be recycled,"PCHMA has almost zero water absorption, making it highly dimensionally stable for optics.",https://www.youtube.com/results?search_query=Polycyclohexyl+methacrylate